{
  "record": "graph_spec",
  "schema_version": 1,
  "graph_id": "evidence_pilot",
  "revision": 1,
  "display_name": "Evidence resolution fixture",
  "nodes": [
    {
      "id": "cs_patch",
      "revision": 1,
      "kind": "task",
      "prompt": "Capture the supplied patch as an exact candidate against the pinned base.",
      "result_type": {
        "schema_id": "patch_result",
        "version": 1,
        "digest": "sha256:b1c1b8c067c32461290f77aae4d0e92e18f088dec996b37abbf1221a6a30bebc"
      },
      "acceptance": {
        "claim": "A typed patch artifact exists against the pinned base.",
        "required_checks": ["artifact_exists", "base_matches"],
        "verifier": {
          "id": "patch_capture",
          "version": 1,
          "digest": "sha256:3d630a6d9b2aca85afb6ec4a82377b4c5dc5a6cbb208e9d4f21d0a4274de9c98"
        },
        "policy_ref": { "id": "trusted_local", "version": 1 }
      },
      "authority_policy_ref": { "id": "no_external_actions", "version": 1 },
      "evidence_ports": [
        {
          "name": "candidate",
          "kind": "code",
          "expected_type": {
            "schema_id": "patch_result",
            "version": 1,
            "digest": "sha256:b1c1b8c067c32461290f77aae4d0e92e18f088dec996b37abbf1221a6a30bebc"
          },
          "required": true,
          "allowed_source_scope": ["repo:pilot"],
          "handling_policy_ref": { "id": "local_evidence", "version": 1 }
        },
        {
          "name": "build_log",
          "kind": "logs",
          "expected_type": {
            "schema_id": "log_ref",
            "version": 1,
            "digest": "sha256:f9383666accc6a35212a405451131a0744d9a805fac15e8bd69bcfb235506202"
          },
          "required": false,
          "allowed_source_scope": ["logs:ci"],
          "handling_policy_ref": { "id": "local_evidence", "version": 1 }
        },
        {
          "name": "research",
          "kind": "rag",
          "expected_type": {
            "schema_id": "retrieval_findings",
            "version": 1,
            "digest": "sha256:abababababababababababababababababababababababababababababababab"
          },
          "required": false,
          "allowed_source_scope": ["corpus:none"],
          "handling_policy_ref": { "id": "admitted_corpus", "version": 1 }
        }
      ]
    },
    {
      "id": "cs_ci",
      "revision": 1,
      "kind": "check",
      "prompt": "Run the required checks against the exact candidate.",
      "result_type": {
        "schema_id": "software_check_result",
        "version": 1,
        "digest": "sha256:3b8e4d6ab33aa7cde1fa48b7f876623fd1cb2c6496d55add2e1c729ae5c42931"
      },
      "acceptance": {
        "claim": "The required checks passed for this exact candidate.",
        "required_checks": ["fmt", "clippy", "test"],
        "verifier": {
          "id": "software_check",
          "version": 1,
          "digest": "sha256:74f98a16dbc14bf52a1227c68cdfd5632b9bc20eb89723c736e9e9218bdf1069"
        },
        "policy_ref": { "id": "trusted_local", "version": 1 }
      },
      "authority_policy_ref": { "id": "no_external_actions", "version": 1 },
      "deps": [
        {
          "node": { "graph_id": "evidence_pilot", "node_id": "cs_patch", "revision": 1 },
          "output_port": "result",
          "expected_type": {
            "schema_id": "patch_result",
            "version": 1,
            "digest": "sha256:b1c1b8c067c32461290f77aae4d0e92e18f088dec996b37abbf1221a6a30bebc"
          }
        }
      ],
      "evidence_ports": [
        {
          "name": "patch",
          "kind": "proofs",
          "expected_type": {
            "schema_id": "patch_result",
            "version": 1,
            "digest": "sha256:b1c1b8c067c32461290f77aae4d0e92e18f088dec996b37abbf1221a6a30bebc"
          },
          "required": true,
          "allowed_source_scope": ["node:cs_patch"],
          "handling_policy_ref": { "id": "local_evidence", "version": 1 }
        },
        {
          "name": "checkout",
          "kind": "code",
          "expected_type": {
            "schema_id": "patch_result",
            "version": 1,
            "digest": "sha256:b1c1b8c067c32461290f77aae4d0e92e18f088dec996b37abbf1221a6a30bebc"
          },
          "required": true,
          "allowed_source_scope": ["repo:pilot"],
          "handling_policy_ref": { "id": "local_evidence", "version": 1 }
        },
        {
          "name": "ci_log",
          "kind": "logs",
          "expected_type": {
            "schema_id": "log_ref",
            "version": 1,
            "digest": "sha256:f9383666accc6a35212a405451131a0744d9a805fac15e8bd69bcfb235506202"
          },
          "required": true,
          "allowed_source_scope": ["logs:ci"],
          "handling_policy_ref": { "id": "local_evidence", "version": 1 }
        },
        {
          "name": "review",
          "kind": "human",
          "expected_type": {
            "schema_id": "gate_decision",
            "version": 1,
            "digest": "sha256:cdcdcdcdcdcdcdcdcdcdcdcdcdcdcdcdcdcdcdcdcdcdcdcdcdcdcdcdcdcdcdcd"
          },
          "required": false,
          "allowed_source_scope": ["gate:cs_ci"],
          "handling_policy_ref": { "id": "operator_decisions", "version": 1 }
        }
      ],
      "resource_scope": [{ "resource": "checkout", "access": "exclusive" }]
    },
    {
      "id": "cs_research",
      "revision": 1,
      "kind": "task",
      "prompt": "Retrieve evidence from the admitted corpus.",
      "result_type": {
        "schema_id": "retrieval_findings",
        "version": 1,
        "digest": "sha256:abababababababababababababababababababababababababababababababab"
      },
      "acceptance": {
        "claim": "Findings cite exact spans of the admitted corpus.",
        "required_checks": ["citations_resolve"],
        "verifier": {
          "id": "research_evidence_check",
          "version": 1,
          "digest": "sha256:efefefefefefefefefefefefefefefefefefefefefefefefefefefefefefefef"
        },
        "policy_ref": { "id": "trusted_local", "version": 1 }
      },
      "authority_policy_ref": { "id": "no_external_actions", "version": 1 },
      "evidence_ports": [
        {
          "name": "corpus",
          "kind": "rag",
          "expected_type": {
            "schema_id": "corpus_snapshot",
            "version": 1,
            "digest": "sha256:1212121212121212121212121212121212121212121212121212121212121212"
          },
          "required": true,
          "allowed_source_scope": ["corpus:none"],
          "handling_policy_ref": { "id": "admitted_corpus", "version": 1 }
        }
      ]
    },
    {
      "id": "cs_legacy",
      "revision": 1,
      "kind": "task",
      "prompt": "A node written against an older code reference type.",
      "result_type": {
        "schema_id": "patch_result",
        "version": 1,
        "digest": "sha256:b1c1b8c067c32461290f77aae4d0e92e18f088dec996b37abbf1221a6a30bebc"
      },
      "acceptance": {
        "claim": "A typed patch artifact exists against the pinned base.",
        "required_checks": ["artifact_exists"],
        "verifier": {
          "id": "patch_capture",
          "version": 1,
          "digest": "sha256:3d630a6d9b2aca85afb6ec4a82377b4c5dc5a6cbb208e9d4f21d0a4274de9c98"
        },
        "policy_ref": { "id": "trusted_local", "version": 1 }
      },
      "authority_policy_ref": { "id": "no_external_actions", "version": 1 },
      "evidence_ports": [
        {
          "name": "candidate",
          "kind": "code",
          "expected_type": {
            "schema_id": "code_ref",
            "version": 1,
            "digest": "sha256:8e4d4c88a547c0fdc8e0127c26c01a936277beb03ff7fab33692e698a15d5df6"
          },
          "required": true,
          "allowed_source_scope": ["repo:pilot"],
          "handling_policy_ref": { "id": "local_evidence", "version": 1 }
        }
      ]
    }
  ],
  "targets": [{ "graph_id": "evidence_pilot", "node_id": "cs_ci", "revision": 1 }],
  "budget": { "total_attempts": 9 }
}
