{
  "record": "graph_spec",
  "schema_version": 1,
  "graph_id": "review_pilot",
  "revision": 1,
  "nodes": [
    {
      "id": "cs_packet",
      "revision": 1,
      "kind": "task",
      "prompt": "Deliver the cs_packet contract.",
      "result_type": {
        "schema_id": "patch_result",
        "version": 1,
        "digest": "sha256:966a18f2328d6a7294e79b3d02465552440fbd5298a43af907314e7c48c559b1"
      },
      "acceptance": {
        "claim": "cs_packet satisfies its named checks for the exact candidate.",
        "required_checks": [
          "artifact_exists"
        ],
        "verifier": {
          "id": "software_check",
          "version": 1,
          "digest": "sha256:74f98a16dbc14bf52a1227c68cdfd5632b9bc20eb89723c736e9e9218bdf1069"
        },
        "policy_ref": {
          "id": "trusted_local",
          "version": 1
        }
      },
      "authority_policy_ref": {
        "id": "no_external_actions",
        "version": 1
      }
    }
  ],
  "targets": [
    {
      "graph_id": "review_pilot",
      "node_id": "cs_packet",
      "revision": 1
    }
  ],
  "budget": {
    "total_attempts": 3
  }
}
