{
  "record": "graph_spec",
  "schema_version": 1,
  "graph_id": "review_pilot",
  "revision": 4,
  "nodes": [
    {
      "id": "cs_patch",
      "revision": 3,
      "kind": "task",
      "prompt": "Capture the supplied patch as an exact candidate against the pinned base commit.",
      "result_type": {
        "schema_id": "patch_result",
        "version": 1,
        "digest": "sha256:966a18f2328d6a7294e79b3d02465552440fbd5298a43af907314e7c48c559b1"
      },
      "acceptance": {
        "claim": "A typed patch artifact exists against the pinned base.",
        "required_checks": [
          "artifact_exists",
          "base_matches"
        ],
        "verifier": {
          "id": "patch_capture",
          "version": 1,
          "digest": "sha256:3d630a6d9b2aca85afb6ec4a82377b4c5dc5a6cbb208e9d4f21d0a4274de9c98"
        },
        "policy_ref": {
          "id": "trusted_local",
          "version": 1
        }
      },
      "authority_policy_ref": {
        "id": "no_external_actions",
        "version": 1
      },
      "evidence_ports": [
        {
          "name": "candidate",
          "kind": "code",
          "expected_type": {
            "schema_id": "patch_result",
            "version": 1,
            "digest": "sha256:b1c1b8c067c32461290f77aae4d0e92e18f088dec996b37abbf1221a6a30bebc"
          },
          "required": true,
          "allowed_source_scope": [
            "repo:USS-Parks/Checkspan"
          ],
          "handling_policy_ref": {
            "id": "local_evidence",
            "version": 1
          }
        }
      ],
      "display_name": "Supplied patch"
    },
    {
      "id": "cs_ci",
      "revision": 2,
      "kind": "check",
      "prompt": "Run fmt, clippy, and the test suite against the exact candidate.",
      "result_type": {
        "schema_id": "software_check_result",
        "version": 1,
        "digest": "sha256:3b8e4d6ab33aa7cde1fa48b7f876623fd1cb2c6496d55add2e1c729ae5c42931"
      },
      "acceptance": {
        "claim": "The required checks passed for this exact candidate.",
        "required_checks": [
          "fmt",
          "clippy",
          "test"
        ],
        "verifier": {
          "id": "software_check",
          "version": 1,
          "digest": "sha256:74f98a16dbc14bf52a1227c68cdfd5632b9bc20eb89723c736e9e9218bdf1069"
        },
        "policy_ref": {
          "id": "trusted_local",
          "version": 1
        }
      },
      "authority_policy_ref": {
        "id": "no_external_actions",
        "version": 1
      },
      "deps": [
        {
          "node": {
            "graph_id": "review_pilot",
            "node_id": "cs_patch",
            "revision": 3
          },
          "output_port": "result",
          "expected_type": {
            "schema_id": "patch_result",
            "version": 1,
            "digest": "sha256:966a18f2328d6a7294e79b3d02465552440fbd5298a43af907314e7c48c559b1"
          }
        }
      ],
      "evidence_ports": [
        {
          "name": "check_logs",
          "kind": "logs",
          "expected_type": {
            "schema_id": "log_ref",
            "version": 1,
            "digest": "sha256:f9383666accc6a35212a405451131a0744d9a805fac15e8bd69bcfb235506202"
          },
          "required": false,
          "allowed_source_scope": [
            "local:verifier"
          ],
          "handling_policy_ref": {
            "id": "local_evidence",
            "version": 1
          }
        }
      ],
      "display_name": "Software checks",
      "resource_scope": [
        {
          "resource": "checkout",
          "access": "exclusive"
        }
      ]
    },
    {
      "id": "cs_packet",
      "revision": 1,
      "kind": "sink",
      "prompt": "Bind the patch and its check receipt into one review packet.",
      "result_type": {
        "schema_id": "review_packet",
        "version": 1,
        "digest": "sha256:2e41a27f43c3fc0a7bd8b72596df97408eb160b88f186f95c8c263889cdffc7d"
      },
      "acceptance": {
        "claim": "A complete packet binds the patch and its required check receipt.",
        "required_checks": [
          "target_closure",
          "subject_equality"
        ],
        "verifier": {
          "id": "packet_sink",
          "version": 1,
          "digest": "sha256:406d70f2aaa89122f12d1c3b54291ab4469961f3fc4aeac757fe621ec05f869a"
        },
        "policy_ref": {
          "id": "trusted_local",
          "version": 1
        }
      },
      "authority_policy_ref": {
        "id": "no_external_actions",
        "version": 1
      },
      "deps": [
        {
          "node": {
            "graph_id": "review_pilot",
            "node_id": "cs_patch",
            "revision": 3
          },
          "output_port": "result",
          "expected_type": {
            "schema_id": "patch_result",
            "version": 1,
            "digest": "sha256:966a18f2328d6a7294e79b3d02465552440fbd5298a43af907314e7c48c559b1"
          }
        },
        {
          "node": {
            "graph_id": "review_pilot",
            "node_id": "cs_ci",
            "revision": 2
          },
          "output_port": "result",
          "expected_type": {
            "schema_id": "software_check_result",
            "version": 1,
            "digest": "sha256:3b8e4d6ab33aa7cde1fa48b7f876623fd1cb2c6496d55add2e1c729ae5c42931"
          }
        }
      ],
      "display_name": "Review packet"
    }
  ],
  "targets": [
    {
      "graph_id": "review_pilot",
      "node_id": "cs_packet",
      "revision": 1
    }
  ],
  "budget": {
    "total_attempts": 9
  },
  "supersedes": {
    "graph_id": "review_pilot",
    "revision": 3
  }
}
